{
  "name": "operoz-pack-gestao-operacional",
  "version": "1.0.0",
  "description": "Status report semanal, lembretes de SLA de sustentação e alertas de cards sem responsável.",
  "permissions": ["schedule.cron", "action.send_email", "action.notify", "issue.created"],
  "hooks": "hooks/hooks.json",
  "catalog": [],
  "rules": [
    {
      "template_id": "weekly-status-report",
      "name": "[Pack] Status Report Semanal",
      "description": "Relatório semanal por e-mail — pack Gestão Operacional.",
      "parameters": {
        "rule_name": "[Pack] Status Report Semanal",
        "time": "09:00",
        "weekday": 0,
        "timezone": "America/Sao_Paulo",
        "template_id": "00000000-0000-0000-0000-000000000001",
        "recipient_emails": []
      },
      "publish": false
    },
    {
      "template_id": "sla-sustentacao-reminder",
      "name": "[Pack] Lembrete SLA sustentação",
      "description": "Lembrete diário de sustentação — pack Gestão Operacional.",
      "parameters": {
        "rule_name": "[Pack] Lembrete SLA sustentação",
        "time": "10:00",
        "timezone": "America/Sao_Paulo",
        "message": "Revisar cards de sustentação em aberto no board."
      },
      "publish": false
    },
    {
      "template_id": "unassigned-cards-alert",
      "name": "[Pack] Alerta sem assignee",
      "description": "Alerta diário de cards sem responsável — pack Gestão Operacional.",
      "parameters": {
        "rule_name": "[Pack] Alerta sem assignee",
        "time": "17:00",
        "timezone": "America/Sao_Paulo",
        "message": "Existem cards sem responsável — atribua assignees no board."
      },
      "publish": false
    }
  ]
}
